,Link,Occurred,City,State,Country,Shape,Summary,Reported,Posted,Media
1310,Open,07/05/2017 08:14,New Kensington,PA,USA,Cigar,"My husband was taking pictures of an airplane refueling above our home.  After looking at the pictures, that were taken in rapid succes",07/07/2017,07/14/2017,
1311,Open,07/04/2017 22:10,Prospect,PA,USA,Light,"Three bright red lights with no sound moving in a south southwest direction, each following the other by 2-3 minutes.",07/04/2017,07/07/2017,
1312,Open,07/04/2017 21:30,Greencastle,PA,USA,Unknown,"Seen 2 white blinking lights traveling what appeared to be very fast, one going north and one east, they then stopped and returned to o",07/05/2017,07/07/2017,
1313,Open,07/01/2017 23:00,Gallitzin,PA,USA,Oval,Our family of 3 were out on our backyard having a bonfire when all of the sudden we looked up and there was a low flying orangish Amber,07/01/2017,07/07/2017,
1314,Open,07/01/2017 21:50,Sinking Spring,PA,USA,Light,"Three bright lights form triangle, disappear, one by one.",07/01/2017,07/07/2017,
1315,Open,07/01/2017 21:30,Effort,PA,USA,Circle,Slow moving; 3 steady lights:2 or more red and 1 yellow; very quiet,07/02/2017,07/07/2017,
1316,Open,06/30/2017 21:15,Lancaster County,PA,USA,Light,Orange lights disappear into thin air.,07/01/2017,07/07/2017,
1317,Open,06/29/2017 04:23,Brookville,PA,USA,Light,"Trucker reports witnessing a dramatic ""cloud"" of colored light in the E sky.  ((NUFORC Note:  Rocket launch from Wallops Island.  PD))",06/29/2017,07/07/2017,
1318,Open,06/26/2017 01:30,McMurray,PA,USA,Triangle,Awakened by the sounds of animals scratching to get into the house. Went downstairs and my mother was letting the dog into the house. S,06/26/2017,07/07/2017,
1319,Open,06/24/2017 21:00,Ephrata,PA,USA,Fireball,As the wife and I were sitting outside near a field by our home off Arrowhead Dr We saw two red fireball like objects in the sky.  Ther,06/24/2017,07/07/2017,
1320,Open,06/21/2017 20:00,Lansdale,PA,USA,Circle,I didn't notice the picture I took until the evening. there is definitely something else in the sky.  ((NUFORC Note:  Lens flare.  PD)),06/22/2017,07/07/2017,
1321,Open,06/17/2017 22:18,Duncannon,PA,USA,Light,"Observed solid light:  star size, constant high speed and trajectory, very high altitude, moving SW to NE.  ((anonymous report))",06/17/2017,06/22/2017,
1322,Open,06/17/2017 06:00,SECANE,PA,USA,Rectangle,Alien spacecraft cloaked in the clouds.,02/18/2022,03/04/2022,Y
1323,Open,06/12/2017 21:00,Donora,PA,USA,Light,Extremely white flash multiple nights in clear sky.  Like a strobe light but only flashed once.  ((anonymous report)),06/12/2017,06/15/2017,
1324,Open,06/12/2017 20:45,Pocono Lake,PA,USA,Oval,Observed long  narrow streak of fire in the distant sky (almost like the fire shooting from a rocket ship in a 1950s,06/13/2017,06/15/2017,
1325,Open,06/11/2017 21:25,Palmyra,PA,USA,Circle,"Orange glowing craft fly over Palmyra, PA.",06/11/2017,06/15/2017,
1326,Open,06/10/2017 21:50,Reading,PA,USA,Unknown,((HOAX??))  My neighbor and i were sotto g outside when I noticed something changing light red blue and white.  ((anonymous report)),06/10/2017,06/15/2017,
1327,Open,06/10/2017 03:15,Chester,PA,USA,Disk,"Round spacecraft with red blue and white lights, saucer wider on one side.Flying toward water near I-95 above Chester, Pa.",06/10/2017,06/15/2017,
1328,Open,06/09/2017 03:55,Derry,PA,USA,Light,Orange lights in the sky.,06/12/2017,06/15/2017,
1329,Open,06/08/2017 22:03,Lock Haven,PA,USA,Light,"Star-like/sattelite-like craft spotted heading northeast, making multiple abrupt stops, before zipping off towards the east.",06/08/2017,06/09/2017,
1330,Open,06/03/2017 23:30,Balliettsville,PA,USA,Circle,"		I looked out my back door that faces N, I looked NW and saw about 15 LED looking orange lights in sky going SW.  ((anonymous report))",06/04/2017,06/09/2017,
1331,Open,06/03/2017 23:10,Montoursville,PA,USA,Light,"Approximately 23:10 on Saturday, June 3, 2017 my family and I were returning home and noticed 4 very strange lights due north of Montou",06/03/2017,06/09/2017,
1332,Open,06/01/2017 03:35,Mountain Top,PA,USA,Light,Light in night sky.,06/01/2017,06/02/2017,
1333,Open,05/20/2017 10:39,Philadelphia,PA,USA,Circle,((HOAX??))  Four people saw an orange dot moving in different directions.  ((anonymous report)),05/20/2017,06/02/2017,
1334,Open,05/19/2017 21:17,Wilkes-Barre,PA,USA,Fireball,On my way to McDonald's up near the mall my wife and I saw an orange fireball going across the sky in a straight line. It was too fast,05/20/2017,06/02/2017,
1335,Open,05/15/2017 23:00,Lebanon,PA,USA,Formation,Oh mah lawdy,05/15/2017,05/15/2017,
1336,Open,05/15/2017 22:30,Pittsburgh,PA,USA,Circle,Red Round Glowing Light. Still except once made a small triangle. Maybe some orange lights. Disappeared by shrinking.,05/19/2017,06/02/2017,
1337,Open,05/15/2017 03:00,Roxborough,PA,USA,Cigar,I was driving my car down Henry Avenue and I saw this object coming down a Crossing Street leverington Avenue I pulled up to a red ligh,10/29/2019,12/01/2019,
1338,Open,05/15/2017 00:20,Rockledge,PA,USA,Circle,"Saw a ball of light spring up from ground It was white with trials of smaller white lights. I was alone, and it scared me. It was fast,",05/15/2017,05/15/2017,
1339,Open,05/15/2017 00:20,Rockledge,PA,USA,Circle,Looking up at the moon.  I was all alone.  A white hot ball of light shot quickly above my head.it was fast n not a sound. It had these,05/15/2017,05/15/2017,
1340,Open,05/14/2017 00:10,Williamsport,PA,USA,Triangle,"Triangle , 3 white lights , red light , moveing quickly back and forth then straight up, couldn't hear any noise , hiding in clouds",05/18/2017,06/02/2017,
1341,Open,05/10/2017 21:45,Philadelphia,PA,USA,Oval,The outline/shape of the disk and the lights underneath were very clear but the disk seemed colorless!,05/11/2017,05/11/2017,
1342,Open,05/01/2017 00:00,Taylor,PA,USA,Other,I was a skeptic until I was driving down main street in my small little town and then about 500 feet I see what I thought was an a/c.,05/02/2017,05/06/2017,
1343,Open,04/29/2017 21:00,Chambersburg,PA,USA,Disk,2 larger than planet size bell/saucer shapes with bright amber/white light emitting from each hovered briefly then vanished.,04/30/2017,05/06/2017,
1344,Open,04/20/2017 00:10,Kennett Square,PA,USA,Unknown,Unknown Lights,04/20/2017,04/28/2017,
1345,Open,04/18/2017 21:32,Warminster,PA,USA,Unknown,"Ufo videos, changing lights and moving short distances back and forth  ((NUFORC Note:  Sighting of Jupiter?  PD))",04/18/2017,04/20/2017,
1346,Open,04/16/2017 23:40,Ardsley,PA,USA,Cigar,Looked as if it were flying straight for my house. Both were an orangey color. One stayed still while the other flew around it. The one,04/16/2017,04/20/2017,
1347,Open,04/15/2017 20:30,Willowdale,PA,USA,Orb,"Orange glowing orb, pulsing, silent, slow moving, slightly redder in center at height of pulsation",04/16/2017,04/20/2017,
1348,Open,04/12/2017 01:00,Harrisville,PA,USA,Other,Woke up in the middle of the nite with a weird looking flesh tone grey shape leaning down touching my R side. ((anonymous report)),04/14/2017,04/20/2017,
1349,Open,04/10/2017 00:10,York,PA,USA,Triangle,I don't remember the exact date or even the month this happened. I know it was spring 2007 or 2008. I got off work at 12 & headed down,01/19/2020,02/07/2020,
1350,Open,04/09/2017 04:55,Philadelphia,PA,USA,Light,Small light travelling fast slows to mid air stop for another light to catches up and they both slowyou flewith away. Over center city.,04/09/2017,04/13/2017,
1351,Open,04/03/2017 08:00,Philadelphia,PA,USA,Diamond,I was at the corner of Allegheny and Kensington in Philadelphia waiting for the bus. It was approximately 8 am on 4/3/17  It was a love,04/03/2017,04/07/2017,
1352,Open,03/11/2017 21:00,Camp Hill,PA,USA,Unknown,Hovering Object with White light.,03/17/2017,03/23/2017,
1353,Open,03/11/2017 19:50,Oley,PA,USA,Circle,"1 flat possible circle, 3 solid light blue lights. Tailed by 2 mil. helicopters with 2 blinking red lights.  ((anonymous report))",03/11/2017,03/17/2017,
1354,Open,03/07/2017 21:20,Philadelphia,PA,USA,Chevron,I noticed an extremely bright object ascend from below the horizon at a high rate of speed and in a perfectly straight line.,03/07/2017,03/10/2017,
1355,Open,03/05/2017 13:30,Honeybrook,PA,USA,Circle,"3 white spheres drifting, twirling, and zooming out of sight.",03/05/2017,03/10/2017,
1356,Open,03/04/2017 23:00,Pittsburgh,PA,USA,Light,((HOAX??))  Two strange red lights.  ((anonymous report)),03/05/2017,03/10/2017,
1357,Open,02/28/2017 00:30,Thorndale,PA,USA,,Green light flash with no noise.  ((anonymous report)),02/27/2017,03/10/2017,
1358,Open,02/26/2017 20:30,Easton,PA,USA,Fireball,This looked like a flare that was shot into the sky. 2nd time I have seen this in a month.  ((anonymous report)),02/26/2017,03/10/2017,
1359,Open,02/24/2017 21:00,Wapwallopen,PA,USA,,"Five lights were caught on my trail camera. The camera was stationary. Three pictures were taken. The object started in the distance, t",05/15/2017,05/15/2017,
1360,Open,02/24/2017 20:00,Uniontown,PA,USA,Circle,All are seen on night vision camera for 5 days now. A large moon shaped one moved. ((anonymous report)),03/04/2017,03/10/2017,
1361,Open,02/23/2017 19:40,Greenfield Twp,PA,USA,Circle,Flashing light.,02/26/2017,03/10/2017,
1362,Open,02/23/2017 19:30,Reading,PA,USA,Unknown,Very fast object moving quickly back and forth in the sky.,02/23/2017,03/10/2017,
1363,Open,02/23/2017 18:43,Philadelphia,PA,USA,Changing,"What did we all see?  Same craft, different night.  ((NUFORC Note:  Possible sighting of Venus??  PD))",02/23/2017,03/10/2017,
1364,Open,02/23/2017 13:00,Bensalem,PA,USA,Other,Just a picture.,02/22/2017,03/10/2017,
1365,Open,02/22/2017 21:09,Harrisburg,PA,USA,Other,"Stationary hovering three tiered object, a short row of red lights above and below a long row of white lights.",02/22/2017,03/10/2017,
1366,Open,02/22/2017 21:00,Tamaqua,PA,USA,Cylinder,Saw 2 cyl.-shaped objects with 6-8 white flashing lights.  They appeared to fly over each other from opposite dir..((anonymous report)),02/22/2017,03/10/2017,
1367,Open,02/20/2017 20:50,Porter township,PA,USA,Light,"Bright light hovering, thought it was a planet but then it moved after 15 minutes.",02/20/2017,02/22/2017,
1368,Open,02/20/2017 18:30,Chambersburg,PA,USA,Orb,Bright orb like object moving very fast in an alrming route of motion.,07/24/2017,07/27/2017,
1369,Open,02/19/2017 19:30,Bushkill Township,PA,USA,Light,"Bright light in sky last three days.  ((NUFORC Note:  Venus, we, too, suspect.  PD))",02/19/2017,02/22/2017,
1370,Open,02/18/2017 06:00,MckeesRocksr,PA,USA,Disk,MY HUSBAND AND I SAW A DISC SHAPED OBJECT TRAVEL TO WARD THE WEST ON S.BOUND 79,02/18/2017,02/22/2017,
1371,Open,02/18/2017 00:00,Gettysburg,PA,USA,Circle,I saw some sort of object flying in the sky that wasn't an airplane.,02/17/2017,02/22/2017,
1372,Open,02/17/2017 23:27,Millvale,PA,USA,Fireball,Driving on Rt 28 north  heading to my gilr frinds house when just before the Millvale exit 4 a green fire ball was to my left just over,02/18/2017,02/22/2017,
1373,Open,02/17/2017 22:15,Moon Township/clinton,PA,USA,Fireball,I am a delivery driver returning back to the home base and at 10:15 I was driving on 376 west bound just about one half mile from the P,02/18/2017,02/22/2017,
1374,Open,02/16/2017 06:15,Bushkill,PA,USA,Light,"I saw a white light hovering in the distance. I know it can't be a helicopte, no flashing lights.  ((NUFORC Note:  Venus?  PD))",02/16/2017,02/17/2017,
1375,Open,02/14/2017 19:35,Bethlehem,PA,USA,Fireball,One White light and one reddish ball of fire light by grocery store in Bethlehem Pa.,02/16/2017,02/17/2017,
1376,Open,02/06/2017 22:50,Arnold,PA,USA,Unknown,Orange glow over western PA.,02/06/2017,02/10/2017,
1377,Open,02/06/2017 00:10,Lancaster,PA,USA,Orb,Emitted a bright white light.  ((anonymous report)),02/09/2017,02/10/2017,
1378,Open,01/31/2017 18:40,Mechanicsburg,PA,USA,Light,Four orange yellow lights side by side in a slight 15 degree angle slanting to the right.,02/01/2017,02/03/2017,
1379,Open,01/09/2017 18:00,Gouldsboro,PA,USA,Triangle,"Bright light moving left, right, up and down.   ((NUFORC Note:  Possible sighting of Venus??  Anonymous report.  PD))",01/10/2017,01/12/2017,
1380,Open,01/02/2017 23:50,McMurray,PA,USA,Flash,Bight flashing lights underneath a heavy cloudy sky.  Extremely bright and flashing.  No stars visible tonight. This was large and was,04/02/2017,04/07/2017,
1381,Open,12/31/2016 22:00,Hallam,PA,USA,Circle,"3 orange lights, 3-4 minute duration, then vanish.  ((anonymous report))",01/03/2017,01/06/2017,
1382,Open,12/26/2016 21:30,Philadelphia (100 naut. miles E of; over water),PA,USA,Light,Solid/flashing light over the Atlantic Ocean.  ((NUFORC Note:  Report from commercial/ATP pilot.  PD)),01/06/2017,01/12/2017,
1383,Open,12/25/2016 20:30,Whitehall,PA,USA,Other,Disappearing craft/craft with capability of being invisible witnessed,12/25/2016,12/30/2016,
1384,Open,12/25/2016 20:15,New London,PA,USA,Circle,4 orange globes diamond pattern.,12/25/2016,12/30/2016,
1385,Open,12/21/2016 21:45,Shrewsbury,PA,USA,Other,"All white lights, bright, one shaped like a square with a triangle on top.",12/21/2016,12/30/2016,
1386,Open,12/21/2016 19:30,Cheltenham,PA,USA,Light,3 bright white lights in vertical line in night sky.  ((anonymous report)),12/21/2016,12/30/2016,
1387,Open,12/12/2016 01:00,Tamaqua,PA,USA,Unknown,I ((name deleted)) heard a loud engine locamotive type sound coming from outside the house got out bed to see if someone was in my driv,01/15/2017,01/19/2017,
1388,Open,12/11/2016 14:00,Chester,PA,USA,Formation,"Saw UFO, over DE river.....4 flashing lights.",12/11/2016,12/15/2016,
1389,Open,12/06/2016 17:30,Holland,PA,USA,Sphere,"It was a bright red sphere that lit up the woods as it passed slowly overhead, traveling east until it went up over the ridge by Nesham",12/06/2016,12/15/2016,
1390,Open,12/05/2016 16:00,Elizabethtown (near),PA,USA,Changing,Light seen changing shape and color moving rapidly over PA.,12/06/2016,12/15/2016,
1391,Open,12/02/2016 23:00,Altoona,PA,USA,Oval,"Yes,on the night of12/02/2016,I and one other person was walking to my house and seen a oval shaped ufo.just havering in the sky.it is",08/10/2021,08/16/2021,
1392,Open,12/02/2016 22:00,Philadelphia,PA,USA,Light,Lights in the sky in Philly!!!  ((NUFORC Note:  Advertising lights.  PD)),12/04/2016,12/05/2016,
1393,Open,11/27/2016 10:00,Allentown,PA,USA,Fireball,"((HOAX??))  Orange UFO in a swarm in Allentown, PA.  ((anonymous report))",11/27/2016,12/05/2016,
1394,Open,11/22/2016 19:30,Cecil,PA,USA,Formation,"4 orange lights flying in formation - straight line, formation broke two went straight up, totally silent - seemed choreographed.",11/22/2016,12/05/2016,
1395,Open,11/19/2016 07:00,Smithton,PA,USA,Oval,"Saw a unidentified object flying thru Smithton, PA, on I-70.7:00 am Friday 11-18-2016.",11/20/2016,12/05/2016,
1396,Open,11/18/2016 10:45,Mc Murray,PA,USA,Triangle,"Hovered in sky for about 30 min., then quickly moved east no sound and many lights in a triangle shape.",11/20/2016,12/05/2016,
1397,Open,11/17/2016 19:24,Lower Burrell,PA,USA,Triangle,GREEN TRIANGLE.,11/17/2016,12/05/2016,
1398,Open,11/15/2016 17:00,Pottstown,PA,USA,Circle,"Late afternoon saw a small cloud.  It just looked different, whiter/brighter.  ((anonymous report))",03/01/2017,03/10/2017,
1399,Open,11/13/2016 23:15,Palmyra,PA,USA,Circle,Very slow moving object in SE sky.  Viewed obj. with binox and there were at least 3 distinct red lights.((NUFORC Note:  Sirius?  PD)),11/13/2016,12/05/2016,
1400,Open,11/13/2016 18:25,Monroeville,PA,USA,Fireball,"Multiple circular fireballs ascended into the sky, one after the other, from the Monroeville airport.  Each continued moving upward int",11/14/2016,12/05/2016,
1401,Open,11/10/2016 18:00,Washington,PA,USA,Light,Bright unknown object hovered for 60 minutes.,11/10/2016,11/11/2016,
1402,Open,11/07/2016 20:20,Moon,PA,USA,Triangle,A triangular shaped object with yellow outline with all congruent sides was moving north at 30mph.,11/07/2016,11/11/2016,
1403,Open,11/07/2016 19:45,Reinholds,PA,USA,Sphere,"Large pulsing multicolored light hovering at cloud line.  Pulsed for 2 minutes, then disappeared.  ((anonymous report))",11/07/2016,11/11/2016,
1404,Open,11/06/2016 18:45,Pittsburgh,PA,USA,Unknown,Saw 2 bright glowing orbs in Pittsburgh.,11/06/2016,11/11/2016,
1405,Open,11/05/2016 17:15,Philadelphia,PA,USA,Other,4 Bright White Cigar/Long Disc Shape - Traveling Slanted in sky - Dissapeared & Reappeared 3 jets chasing them -Witnessed by 2 in car,11/06/2016,11/11/2016,
1406,Open,11/04/2016 18:00,Marianna,PA,USA,Other,Since summer 2016 there have been small glowing stationary lights (resembling) stars… ((NUFORC Note:  Stars??  PD)),11/05/2016,11/11/2016,
1407,Open,11/01/2016 20:25,Tarentum,PA,USA,Fireball,Got out of the car and I witnessed a bright green fireball just above the clouds.,11/01/2016,11/04/2016,
1408,Open,11/01/2016 19:30,Harrisburg (near; on I-83),PA,USA,Triangle,My son and I were driving home I-83 N on our way home.  I saw something to my left but in front of me. ((anonymous report)),11/20/2016,12/05/2016,
1409,Open,11/01/2016 09:40,Bensalem,PA,USA,Oval,Hindenburg-shaped craft moving at helicopter speed.,11/03/2016,11/04/2016,
1410,Open,10/31/2016 19:55,Pennsburg,PA,USA,Unknown,"Tracked lights then looked away and then they were gone, nowhere to be found.",11/01/2016,11/04/2016,
1411,Open,10/25/2016 19:15,Bethlehem,PA,USA,Unknown,"Saw 2 white light silent, low-flying crafts in the area of Bethlehem Catholic High School in Bethlehem PA on Oct. 25 at 7:15 PM",10/25/2016,10/27/2016,
1412,Open,10/25/2016 03:00,Willow Grove,PA,USA,Orb,"Saw bright light far in the sky orbiting and lights turning green,red and yellow. It moved back and forth.  ((NUFORC Note:  Star?  PD))",10/26/2016,10/27/2016,
1413,Open,10/22/2016 23:38,Philadelphia,PA,USA,Cigar,"Using my binoculars I witnessed a cigar shaped, rusty orange colored object fly from my south to east .",10/24/2016,10/27/2016,
1414,Open,10/22/2016 18:15,Moon,PA,USA,Triangle,"Object hovered alongside highway, outlined in green light.  ((anonymous report))",10/22/2016,10/27/2016,
1415,Open,10/21/2016 22:15,Elizabethtown,PA,USA,Triangle,"V-shaped, fast moving set of lights above the clouds.",10/21/2016,10/27/2016,
1416,Open,10/18/2016 21:01,Mountain Top,PA,USA,Sphere,"Saw a bright star move from a stationary position to a full 90 degree downward to the right, lit up to 3x the size and took off.",10/19/2016,10/21/2016,
1417,Open,10/15/2016 23:15,Philadelphia,PA,USA,Sphere,"A single orange light traveled in a slow, erratic, yet seemingly controlled pattern across the sky.",10/15/2016,10/21/2016,
1418,Open,10/15/2016 19:30,Aliquippa,PA,USA,Light,Sitting at a fire i looked at what seemed to be a bright star that just slowly faded and disappeared. ((NUFORC Note:  Satellite??  PD)),10/15/2016,10/21/2016,
1419,Open,10/13/2016 21:00,Newfoundland,PA,USA,Orb,"Large orbs rising from behind eastern mountains,traveling s on rt.196s just After sterling corners.seen many over 2 year period.they ac",10/14/2016,10/21/2016,
1420,Open,10/10/2016 19:17,Elizabethtown,PA,USA,Fireball,Single slow moving fireball that changed direction.,10/11/2016,10/13/2016,
1421,Open,10/10/2016 19:17,Elizabethtown,PA,USA,Fireball,"I believe the sighting over Elizabethtown, PA, was a single Chinese lantern.",10/14/2016,10/21/2016,
1422,Open,10/09/2016 23:20,Harrison City,PA,USA,Formation,2 objects seen.  One larger bright white starburst; the second a glowing red sphere.,10/09/2016,10/11/2016,
1423,Open,10/07/2016 07:00,Meadville,PA,USA,Circle,My coworker and I were getting ready to walk into work and a green neon light appeared and shot across the sky fast and smooth and look,10/07/2016,10/11/2016,
1424,Open,10/06/2016 20:00,Saylorsburg,PA,USA,Fireball,"Approx. 4 seconds, a bright thick streak of light in sky & is low. bottom tip explodes bright white light & bits burst out & then gone",10/06/2016,10/11/2016,
1425,Open,10/06/2016 20:00,Lower Burrell,PA,USA,Triangle,"Low, slow and silent unidentifiable flying object.",10/07/2016,10/11/2016,
1426,Open,10/04/2016 23:15,Williamsport,PA,USA,Flash,Standing on my deck looking across the river I multiple flashes that were super bright and unform. Very short lived.,10/04/2016,10/11/2016,
1427,Open,10/04/2016 22:00,Greenfield township,PA,USA,Cylinder,Me. And. A. Buddy.  Where. Chit. Chatting. On my. Back. Patio.  In the evening. Nice calm quiet night. I live. In a rural. Farmland. Ar,04/25/2021,05/20/2021,
1428,Open,10/01/2016 16:20,West Park,PA,USA,Triangle,Three solid lights with no other blinking lights or sound covering a angle of sight of pi/2 for the duration of the event,10/01/2016,10/11/2016,
1429,Open,09/27/2016 20:15,West pittston,PA,USA,Circle,At 8:15 p.m. I saw a circular object with 5 bright white lights coming Southeast going Northwest it made no sound and was flying very l,09/27/2016,09/30/2016,
1430,Open,09/27/2016 10:30,Bernville,PA,USA,Triangle,Triangle shaped aircrafts with no sound bright lights.  ((anonymous report)),09/28/2016,09/30/2016,
1431,Open,09/25/2016 12:30,Pittsburgh,PA,USA,Chevron,Saw a triangle/chevron shape black and red craft flying over the clouds at a high rate of speed to the south,09/25/2016,09/30/2016,
1432,Open,09/24/2016 21:00,Lancaster,PA,USA,Circle,My uncle went outside to smoke a cigarette and he happened to spot the formation of the orange lights. They flickered as they gliding t,09/24/2016,09/30/2016,
1433,Open,09/24/2016 21:00,Macungie,PA,USA,Light,"Macungie, PA-8 staggered red lights in sky traveling slowly W to S over South Mountain at 9 PM 9/24/16.",09/24/2016,09/30/2016,
1434,Open,09/24/2016 19:30,Philadelphia,PA,USA,Light,"Outside about 7;30 pm on sat 9/24/16 cleaning and doing maintenance work at my auto repair shop in phila when I look up, its now dusk,",09/25/2016,09/30/2016,
1435,Open,09/24/2016 03:22,Indiana Twp,PA,USA,Rectangle,Picture on my trail camera,09/02/2022,09/09/2022,Y
1436,Open,09/22/2016 21:30,Glenside,PA,USA,Triangle,I just know something hovered by tonight over the top of our car that I cannot fully explain and unidentified.,09/22/2016,09/30/2016,
1437,Open,09/20/2016 20:35,Freeland,PA,USA,Light,Another Freeland Light Sighting.  ((NUFORC Note:  We suspect the objects may have been stars.  PD)),09/20/2016,09/22/2016,
1438,Open,09/20/2016 20:15,Harrisburg,PA,USA,Other,Bright stadium like lights across a very large long object moving across sky then vanished.,09/20/2016,09/22/2016,
1439,Open,09/20/2016 19:45,Charleroi,PA,USA,Cylinder,4 bright goldish lights stationary-moving randomly then disappearing,09/21/2016,09/22/2016,
1440,Open,09/18/2016 10:00,Bensalem,PA,USA,Circle,I was walking my dog outside and noticed 2 red lights side by side that looked like red eyes and underneath the 2 red lights was a brig,09/18/2016,09/22/2016,
1441,Open,09/15/2016 19:00,Warminster,PA,USA,Light,Watched circular object approach plane an flash it with a bright light and fly past it.  A short time later a similar object.,09/15/2016,09/22/2016,
1442,Open,09/14/2016 21:10,Pittsburgh,PA,USA,Light,Large circular light spotted in airspace above Consol Energy Center,09/14/2016,09/15/2016,
1443,Open,09/13/2016 22:30,Sugar Grove,PA,USA,Light,"Moving color changing lights in the night sky over forest.  ((NUFORC Note:  ""Twinkling"" stars??  PD))",09/14/2016,09/15/2016,
1444,Open,09/11/2016 20:00,Freeland,PA,USA,Light,Several lights in same area for extended period of time with unusual cloud formation present.,09/11/2016,09/15/2016,
1445,Open,09/11/2016 07:01,Warren,PA,USA,Circle,Bright circle shape low. Not a plane.was there for about 3 min pulled over it was gone,09/13/2016,09/15/2016,
1446,Open,09/09/2016 23:45,Ridley Park,PA,USA,Circle,The light was a perfect circle moving in a circular pattern above the clouds.,09/10/2016,09/15/2016,
1447,Open,09/06/2016 16:00,Bangor,PA,USA,Rectangle,Let's just made no sound and had no propulsion devices.,09/06/2016,09/09/2016,
1448,Open,09/05/2016 20:00,South Park Township,PA,USA,Orb,White and orange lights that seemed to be intelligent/intelligently controlled followed us all night.,09/24/2016,09/30/2016,
1449,Open,09/05/2016 04:00,Jefferson Hills,PA,USA,Orb,"Bright white orbs in the trees, atop a hill,and partially silent yellowish orb with quieter jet-like sound.",09/20/2016,09/22/2016,
1450,Open,09/04/2016 19:18,West Chester,PA,USA,Other,"Strange irregular shaped object, possibly some kind of baloon, sending photo.",09/04/2016,09/09/2016,
1451,Open,09/04/2016 01:00,Donora,PA,USA,Light,Wasn't a plane.,09/03/2016,09/09/2016,
1452,Open,09/03/2016 20:25,Sellersville,PA,USA,Light,"Objects were round, twice the size of a star, bright orangey color, there were about 15-20 of these things.",09/04/2016,09/09/2016,
1453,Open,09/03/2016 17:00,Springesttbury,PA,USA,Other,UFO shaped like the number 4 !!,12/05/2019,12/19/2019,
1454,Open,09/02/2016 05:20,Riegelsville,PA,USA,Changing,Approx. 5:20 AM looking south saw a somewhat cylindrical blinking object at about 35 degrees above the horizon. Assumed it was a plane,09/04/2016,09/09/2016,
1455,Open,09/01/2016 22:00,Lehighton,PA,USA,Fireball,Two red spheres with a yellow center following a path from north to south,09/02/2016,09/02/2016,
1456,Open,08/30/2016 20:00,Pittsburgh,PA,USA,Sphere,"Saw 3 red lights hovering in distance, about the height of typical aircraft. 3 red lights hovered in a triangular pattern, one by one,",08/30/2016,09/02/2016,
1457,Open,08/28/2016 18:00,Pottstown,PA,USA,Circle,Metallic circle craft seen in sky.,08/31/2016,09/02/2016,
1458,Open,08/26/2016 20:15,Gilbertsville,PA,USA,Rectangle,"Three black rectangular objects, traveling in a line at low altitude with no sound or apparent means of propulsion.",08/29/2016,09/02/2016,
