,Link,Occurred,City,State,Country,Shape,Summary,Reported,Posted,Media
3817,Open,02/20/2006 21:00,Hanover,PA,USA,Triangle,"While returning from evening graduate class (in nearby Westminster, MD) and passing local lake, I noticed a triangle of red lights with",08/24/2020,08/27/2020,
3818,Open,02/18/2006 01:00,Monroeton,PA,USA,Light,it   was  weird    to  see  a  ufo   this  was  my  first time.,02/18/2006,03/11/2006,
3819,Open,02/15/2006 18:15,Middletown,PA,USA,Light,"This is the second time I have seen these lights, and just by looking on this website, others are seeing the same thing.

 The first",02/22/2006,03/11/2006,
3820,Open,02/11/2006 01:40,Erwinna,PA,USA,Light,A bright light just above the tree line with scanning red lights.  ((NUFORC Note:  Possible sighting of a celestial body?  PD)),02/11/2006,02/14/2006,
3821,Open,02/10/2006 21:00,Morgantown,PA,USA,Formation,"large birds?  flying at a very high altitude in a circle- couldn't have been birds, they glowed in the dark and traded light- it looked",02/27/2006,03/11/2006,
3822,Open,02/03/2006 14:00,Philadelphia,PA,USA,Other,Dull black metallic oddly-shaped floating craft,02/06/2006,02/14/2006,
3823,Open,02/02/2006 17:00,Hershey,PA,USA,Cigar,4 orange lights in Northern Sky over Hershey Pa,02/03/2006,02/14/2006,
3824,Open,01/29/2006 21:00,Mount Pocono,PA,USA,Light,Very large and bright flash at treeline - directly in front of me,01/29/2006,02/14/2006,
3825,Open,01/26/2006 23:00,Bloomsburg,PA,USA,Diamond,"Diamond-shaped flying object with lights at the corners, near Bloomsburg, PA, travelling NNW, lasted from about 23:00 to 23:10.",01/27/2006,02/14/2006,
3826,Open,01/26/2006 21:00,Denver,PA,USA,Circle,Six Bright Lights in Static Formation,01/30/2006,02/14/2006,
3827,Open,01/24/2006 20:00,Washington,PA,USA,Disk,"UFO I seen in Washington, PA?",04/07/2006,05/15/2006,
3828,Open,01/19/2006 19:00,Beach Lake,PA,USA,Triangle,Movement of three from a delta pattern to a line of three.,01/19/2006,02/14/2006,
3829,Open,01/17/2006 22:30,King of Prussia,PA,USA,Sphere,Small Spherical Object moving silently to the West,01/17/2006,02/14/2006,
3830,Open,01/12/2006 19:00,New Cumberland,PA,USA,Light,rows of bright lights in the sky,01/12/2006,02/14/2006,
3831,Open,01/04/2006 07:45,Scotland,PA,USA,Light,"Small, white, light in the northeast sky...disappeared",01/04/2007,02/01/2007,
3832,Open,12/24/2005 19:35,Philadelphia,PA,USA,Triangle,V SHAPE (5 LIGHTS) FLYING OBJECT IN THE WEST PHILADELPHIA AREA ON 12/24/05 17:35. STEALTH?,12/29/2005,02/14/2006,
3833,Open,12/23/2005 06:00,Bethel Park,PA,USA,Oval,"4 oval lights  going in a fast circular path in the clouds above my house. ((NUFORC Note:  Probably advertising lights, rotating.  PD))",12/24/2005,02/14/2006,
3834,Open,12/21/2005 19:30,Export,PA,USA,Flash,"Green flashes of light, several, without sound, that lit up the sky",12/21/2005,02/14/2006,
3835,Open,12/20/2005 00:00,Rimersburg,PA,USA,Changing,it was tringular had three lkights 2 green 1 red the turn into a round shape and was red then stoped and was yello,12/21/2005,02/14/2006,
3836,Open,12/13/2005 21:30,East Springfield,PA,USA,Fireball,Bright blueish white 2 foot diameter ball of light in Erie County.,12/15/2005,12/16/2005,
3837,Open,12/13/2005 19:00,Harrisburg,PA,USA,Formation,A Line of Lights in The North Sky- In the Area of Paxtonia/Lingelstown and By Costco Got Cell Phone Video!,01/27/2006,02/14/2006,
3838,Open,12/13/2005 18:30,Harrisburg,PA,USA,Circle,Four vertical lights,12/14/2005,12/16/2005,
3839,Open,12/12/2005 18:30,King of  Prussia,PA,USA,Other,"White boomerang ,no lights shaped object. KING OF PRUSSIA,PA 18:30 followed by lots of helicopters",12/12/2005,12/16/2005,
3840,Open,12/08/2005 13:00,Media,PA,USA,Fireball,Meteor like object falling to earth very slowly in midaftenoon.,12/08/2005,12/16/2005,
3841,Open,12/04/2005 21:00,Fairless Hills,PA,USA,Chevron,"Chevron shaped objects, multiple lights, heading northwest to southeast at high rate of speed.",12/04/2005,12/16/2005,
3842,Open,11/22/2005 20:40,Chambersburg,PA,USA,Cigar,Cigar shaped object was over my house and me and my friend saw the object.,03/14/2006,05/15/2006,
3843,Open,11/22/2005 18:05,Quarryville,PA,USA,Unknown,Four lights seen in night sky,11/23/2005,12/16/2005,
3844,Open,11/17/2005 03:00,Meadville,PA,USA,Light,"3 flashing light, very bight.",11/19/2005,12/16/2005,
3845,Open,11/12/2005 21:00,West Conshohocken,PA,USA,Fireball,Green-glowing object streaked downward with a white-smoke trail behind it; was gone in 2 seconds.,11/14/2005,12/16/2005,
3846,Open,11/07/2005 23:30,Harrisburg,PA,USA,Flash,A strange objects flashing a color lights with an orangish fireball.,11/07/2005,11/08/2005,
3847,Open,11/07/2005 22:00,Schellsburg,PA,USA,Oval,Large bright light that was pulsating  traveling lower than airplanes and suddenly taken off at a tremendous speed.,11/10/2005,12/16/2005,
3848,Open,11/07/2005 21:00,Schellsburg,PA,USA,Oval,"I was halfway across Shawnee Lake looking towards Schellsburg ,The Mill Road area and saw this more round than oval bright light moving",11/09/2005,12/16/2005,
3849,Open,11/04/2005 10:00,Moscow (near),PA,USA,Sphere,"Metallic, sphere-shaped object briefly visible from car on I-380 South",11/06/2005,11/08/2005,
3850,Open,11/03/2005 21:00,New Castle,PA,USA,Fireball,Orange sphere witnessed streaking over New Castle Pa,11/04/2005,11/08/2005,
3851,Open,11/02/2005 21:05,Plum Borough,PA,USA,Light,Round Light Bursts Into a Rod Shape,11/03/2005,11/03/2005,
3852,Open,11/02/2005 17:45,Pocono Summit,PA,USA,Oval,((NUFORC Note:  Sighting of ISS.  PD))  White Oval Floating Light,11/02/2005,11/03/2005,
3853,Open,11/01/2005 20:00,Clarks Summit,PA,USA,Other,white streaks following one another,11/05/2005,11/08/2005,
3854,Open,10/31/2005 21:30,Lancaster,PA,USA,Light,light across the sky,11/29/2005,12/16/2005,
3855,Open,10/31/2005 21:10,Mt. Pleasant,PA,USA,Flash,Bright green stream of light that was moving south along 119 South.,11/01/2005,11/03/2005,
3856,Open,10/31/2005 21:00,Clearfield/Curwensville,PA,USA,,the object left a trail,11/10/2005,12/16/2005,
3857,Open,10/31/2005 21:00,Johnstown,PA,USA,Egg,lights in SW sky 10/31/05 9pm,11/01/2005,11/03/2005,
3858,Open,10/31/2005 19:15,Chambersburg,PA,USA,Fireball,Fireball,11/07/2005,11/08/2005,
3859,Open,10/29/2005 23:30,Wyndmoor,PA,USA,Fireball,"I was standing outside and counting the number of planes I could see.

I was looking in one direction over the tree lines, and a Fire",10/31/2005,11/03/2005,
3860,Open,10/29/2005 13:42,New Wimington,PA,USA,Other,Photo of  unknown objects in Western Pa with what appears to be flying behind it.,07/15/2007,08/07/2007,
3861,Open,10/21/2005 18:15,Equinunk,PA,USA,Other,6 Streaks of light  in the southwest sky at sunset travelling left to right.,10/22/2005,11/03/2005,
3862,Open,10/19/2005 21:15,Jonestown,PA,USA,Light,Bright circular lights light up the sky in Pennsylvania,10/20/2005,10/20/2005,
3863,Open,10/18/2005 20:30,Downingtown,PA,USA,Cylinder,cylinder object in night sky,10/24/2005,11/03/2005,
3864,Open,10/17/2005 21:00,West Chester,PA,USA,Disk,"saucer object cutting through full moon, south to north",10/21/2005,11/03/2005,
3865,Open,10/17/2005 20:50,West Chester,PA,USA,Oval,Strange black image passed quickly across the sky on a clear autumn night.,11/12/2005,12/16/2005,
3866,Open,10/17/2005 20:00,Kittanning,PA,USA,Light,Unexplainable lights.,10/17/2005,10/20/2005,
3867,Open,10/17/2005 18:35,Chambersburg,PA,USA,Light,Object left no visible exhaust chased by jets leaving white exhaust trails,10/17/2005,10/20/2005,
3868,Open,10/15/2005 23:00,Schuylkill Haven,PA,USA,Light,Amber colored lights in sky.,02/22/2008,03/04/2008,
3869,Open,10/10/2005 20:00,Loretto,PA,USA,Triangle,"Dull red flash, Triangular ship, Vocal Noises",07/26/2006,10/30/2006,
3870,Open,09/30/2005 22:30,Ashland,PA,USA,Circle,Circle of lighst  ((NUFORC Note:  Suspected sighting of a star or planet.  PD)),09/30/2005,10/11/2005,
3871,Open,09/30/2005 10:00,Bellefonte,PA,USA,Cigar,Black tubular telephone size object flying over the Bellefonte PA (near a airport & Penn State) approximately 10:30am on 9/30/2005.,09/30/2005,10/11/2005,
3872,Open,09/29/2005 21:30,Plymouth,PA,USA,Sphere,"Sphere shaped object very similar to a star very close to it, only larger and brighter.",09/29/2005,10/11/2005,
3873,Open,09/29/2005 20:30,Media,PA,USA,Flash,During Astronomy Lab course at Delaware County Community College. Students were looking at the constellation Cassiopeia when left of th,09/30/2005,10/11/2005,
3874,Open,09/07/2005 19:53,Bethel Park,PA,USA,Disk,On my way home I saw this flashing light which soon was showing different colors.,09/07/2005,10/11/2005,
3875,Open,09/07/2005 14:00,Williamsport,PA,USA,Other,"Shape is boomerang and white with colors on bottom, which takes off sideways at blinding speed while other objects are below.",09/07/2005,10/11/2005,
3876,Open,09/06/2005 05:30,Columbia,PA,USA,Disk,"9/6/05 05:30 AM Columbia, PA  30 second duration, disk-shaped craft with lights flying at low altitude",07/13/2006,07/16/2006,
3877,Open,09/03/2005 20:30,Lauglintown,PA,USA,Orb,2 bright white lights moving away from the ground rapidly over the mountains of western PA,03/12/2006,05/15/2006,
3878,Open,09/02/2005 23:30,West Chester,PA,USA,Light,light flashing for about an hour and started slowly moving away,09/02/2005,09/15/2005,
3879,Open,09/02/2005 23:00,Boliver,PA,USA,Circle,"Sept 2nd 2005 11pm Boliver, PA  Witnessed an object in the night sky that moved at impossible speeds in horizontal directions.",09/03/2005,09/15/2005,
3880,Open,08/25/2005 21:00,Nazareth,PA,USA,Light,Light Makes a Very Fast 180 to Follow After Another Light,09/03/2012,09/24/2012,
3881,Open,08/20/2005 21:00,Nazareth,PA,USA,Triangle,Massive Triangle UFO Making a LOT of SOUND that shakes the windows,09/03/2012,09/24/2012,
3882,Open,08/16/2005 21:00,Wilmore,PA,USA,Unknown,"Humanoid spotted in Wilmore, PA",08/18/2005,10/11/2005,
3883,Open,08/16/2005 20:55,Washington,PA,USA,Light,Bright orange stationary light that disappeared quickly.,08/16/2005,10/11/2005,
3884,Open,08/15/2005 21:30,West Chester,PA,USA,Other,Red blinking light circles stationary white light.,08/15/2005,09/15/2005,
3885,Open,08/11/2005 03:00,N. Cambria,PA,USA,Light,These were in the upper atmosphere and definitly under intellengent controll.,08/19/2005,09/02/2005,
3886,Open,08/07/2005 01:30,New Freedom,PA,USA,Light,"((NUFORC Note:  Hoax?? PD))  About 6 weeks ago I was standing out back of my house, letting the dog out at about 1:30 AM.",09/18/2005,10/11/2005,
3887,Open,08/06/2005 07:00,Aston,PA,USA,Orb,Four moving UFO's appear on NASA TV's Shuttle Discovery STS-114 camera. While viewer records it all.,08/23/2005,09/02/2005,
3888,Open,08/01/2005 19:00,Fawn Grove,PA,USA,Triangle,"I was sitting on my back porch early evening about 7pm, the view faces south east for a few miles. I noticed a dark object in the sky a",05/02/2014,05/02/2014,
3889,Open,08/01/2005 03:00,Lake Nockamixon,PA,USA,Circle,Two balls of light pulsating colors zig-zagging across the sky.,09/01/2005,10/11/2005,
3890,Open,07/30/2005 03:00,Erie,PA,USA,Light,BRIGHT LIGHT THAT CAME QUICKLY OVER OUR CAR AND STAYED THERE FOR A FEW SECONDS AND ZOOMED OFF WITHOUT US BEING ABLE TO IDENTIFY IN WHIC,08/03/2005,10/11/2005,
3891,Open,07/21/2005 22:00,Lewisburg,PA,USA,Chevron,3 Chevron shaped craft with exterior lights (red - green) Craft passed over head at an increadable high rate of speed in rapid successi,01/26/2019,02/01/2019,
3892,Open,07/20/2005 04:00,Columbia,PA,USA,Rectangle,"7/20/05 4 AM Columbia, PA 20 seconds or less, large rectangle of white light with vapor trail",07/13/2006,07/16/2006,
3893,Open,07/15/2005 00:30,Conneautville,PA,USA,Disk,Hovering disc seen by two.,12/25/2017,01/12/2018,
3894,Open,07/11/2005 23:45,Indiana,PA,USA,Triangle,"Seven Lights In A Triangular Shape Sighted Over Indiana, Pennsylvania",07/11/2005,07/13/2005,
3895,Open,07/09/2005 23:00,Holland,PA,USA,Light,3 satellites in 10 minute span - third one changes direction and stops; resumes at higher speeds,07/11/2005,07/13/2005,
3896,Open,07/07/2005 22:30,Tidioute,PA,USA,Triangle,A triangular craft with a large white beam in front with a red flashing light in the middle,07/08/2005,07/13/2005,
3897,Open,07/07/2005 19:45,Holland/Newtown,PA,USA,Triangle,3 black triangles in sky defy laws of physics; black helicopter acting strange,07/08/2005,07/13/2005,
3898,Open,06/30/2005 23:25,Jackson,PA,USA,Fireball,((HOAX??))  Looked like it was a red moon coming up over the mountain. I think I may have,11/13/2007,11/28/2007,
3899,Open,06/30/2005 19:30,Altoona,PA,USA,Circle,This is a  UFO sighting in Prospect Park in Altoona in PA back in the year 2005.,04/23/2010,05/12/2010,
3900,Open,06/26/2005 19:10,Levittown,PA,USA,Oval,Unidentified black oval object in South Eastern Pennsylvania sky disappears,06/28/2005,07/05/2005,
3901,Open,06/24/2005 22:45,Bobtown,PA,USA,Triangle,fast moving point of light preceeds large slow triangle over Pennsylvania.,06/24/2005,07/05/2005,
3902,Open,06/23/2005 23:01,Brownsville,PA,USA,Triangle,Triangular craft made of 3 white lights moving very slowly over southwestern PA.,06/23/2005,07/05/2005,
3903,Open,06/21/2005 23:15,Rimersburg,PA,USA,Circle,Was pulseing red and bright yellow colors from big to little.,06/21/2005,07/05/2005,
3904,Open,06/19/2005 14:00,Canton,PA,USA,Cone,Military aircraft and a UFo flying close by.,06/19/2005,06/20/2005,
3905,Open,06/16/2005 22:30,New Brighton,PA,USA,Light,"Flashing, color-changing lights and explosions in the sky.",06/28/2005,07/05/2005,
3906,Open,06/15/2005 22:00,Evans City,PA,USA,Triangle,"VERY Large Triangle Shape Near Butler, PA.",06/30/2014,07/04/2014,
3907,Open,06/09/2005 23:00,Carlisle,PA,USA,Unknown,"I stepped outside for a ciggetett. As I looked up at a star, I noticed flaches of light at different points around this particular star",06/15/2005,06/20/2005,
3908,Open,06/02/2005 15:00,Rahns,PA,USA,Other,Three red potato shaped objects seen,06/11/2005,06/20/2005,
3909,Open,05/20/2005 21:20,Plains,PA,USA,Light,((NUFORC Note:  Sighting of ISS.  PD))  Light traveling straight down then vanished.,05/21/2005,05/24/2005,
3910,Open,05/20/2005 21:05,Russelllton,PA,USA,Unknown,The UFO was seen on Bakerstown Rd in Culmerville PA it was moving east towards Tarentum PA it was a long line with two heads of the obj,05/25/2005,05/28/2005,
3911,Open,05/15/2005 18:00,Catasauqua,PA,USA,Oval,"After reviewing digital pictures on computer, I saw an object near a small plane that I didnt see through the camera.",05/17/2005,05/24/2005,
3912,Open,05/11/2005 23:25,Selinsgrove,PA,USA,Fireball,2-3 craft streak across the sky,05/11/2005,05/24/2005,
3913,Open,05/09/2005 03:00,Carlisle,PA,USA,Chevron,"I was sitting on the front porch, not able to sleep. My dog was with me. Suddenly my dog became very agitated and seemed to want back i",05/17/2005,05/24/2005,
3914,Open,05/07/2005 21:55,Warminster,PA,USA,Light,"Looking southeast from Warminster, PA. I saw a bright neon-green light angle toward the ground low in the sky (about a 60 degree angle)",05/07/2005,05/11/2005,
3915,Open,04/29/2005 23:00,Cheltenham,PA,USA,Disk, Object was large and moved from one direction to another quickly,04/29/2005,05/11/2005,
3916,Open,04/18/2005 17:58,Philadelphia,PA,USA,Rectangle,Object appears on one digital photograph but not the next frame taken seconds later.,05/23/2005,05/24/2005,
3917,Open,04/17/2005 03:30,Erie,PA,USA,Other,swirling lighted cload,04/18/2005,05/11/2005,
3918,Open,04/14/2005 16:30,Sunbury (inflight; location unknown,PA,USA,Egg,Egg shaped object sighted from civilain commuter flight,04/16/2005,04/16/2005,
3919,Open,04/14/2005 05:00,York,PA,USA,Disk,the disk was seen falling from the sky.......a spining..it was spinning ...but no smoke or contrails with it......silver disk in the su,04/15/2005,04/16/2005,
3920,Open,04/03/2005 05:00,Slippery Rock,PA,USA,,blue flashes during night snowstorm with power disruption,04/26/2005,05/11/2005,
3921,Open,03/27/2005 22:30,Derry,PA,USA,Changing,UFO SIGHTING IN DERRY PENNSYLVANIA ON 3/27/05,01/30/2006,02/14/2006,
3922,Open,03/18/2005 01:00,Honey Brook,PA,USA,Flash,space ship flickered lights for what seemed to extend to a mile in length. then a they all lit up at once and then dissapeared.,03/19/2005,05/11/2005,
3923,Open,03/17/2005 14:30,Souderton,PA,USA,Light,"Strange Sighting over Souderton, PA.",01/17/2008,01/21/2008,
3924,Open,03/16/2005 22:32,Port Royal,PA,USA,Light,glowing human shaped figures sighted in wooded area.,03/18/2005,05/11/2005,
3925,Open,03/15/2005 21:50,Grantville,PA,USA,Light,A bright lights bursts into 4 or 5 other lights then dissappears.,03/17/2005,05/11/2005,
3926,Open,03/14/2005 00:00,Philadelphia,PA,USA,Triangle,"buzzing triangular aircafts beams lights and leaving an aura. one very close, beams to the ship",06/18/2005,06/20/2005,
3927,Open,03/13/2005 22:00,Gettysburg,PA,USA,Diamond,"Wingless oblong diamond craft, three close lights near rear",03/20/2005,05/11/2005,
3928,Open,03/09/2005 05:40,Camp Hill,PA,USA,Light,For three minutes around 0540 hrs I observed two bright lights close to each other in the sky afterwhich the lights disappeared.,03/09/2005,05/11/2005,
3929,Open,03/08/2005 22:00,Atglen,PA,USA,Sphere,"Two glowing spheres one quickly moving into a cloud, the other remained stationary for an extended time.",03/13/2005,05/11/2005,
3930,Open,02/15/2005 20:45,Harrisburg,PA,USA,Light,Six lights appear above Harrisburg skyline,02/15/2005,02/22/2005,
3931,Open,02/15/2005 20:45,Harrisburg,PA,USA,Other,I had just come out of my aerobics class and was headed to my car which was parked on the side lot facing the strip mall. I looked up a,02/16/2005,02/22/2005,
3932,Open,02/10/2005 14:00,Scranton/Dickson,PA,USA,Oval,"THIS OBJECT very fast! ability to lift a car and spin it, shown! more! two or so + creatures,bigfoot ;gremlin+",08/17/2005,09/02/2005,
3933,Open,02/06/2005 01:08,Middletown,PA,USA,Light,2 orange lights moving in circular motion in the middle of the night,02/06/2005,02/08/2005,
3934,Open,02/01/2005 19:00,Clarks Summit,PA,USA,Triangle,Triangle craft that split up into three speeding crafts with white lights and little to no sound,02/02/2005,02/08/2005,
3935,Open,01/27/2005 20:00,State College,PA,USA,Diamond,6 Diamond shaped crafts with lights that flashed from red to blue to white on each tip.,01/30/2005,02/08/2005,
3936,Open,01/27/2005 19:30,Corsica,PA,USA,Oval,"Extremely bright oblong object sighted in sky, 7:30 pm, in rural area, viewed app. 3"", moved away pulsing",01/31/2005,02/08/2005,
3937,Open,01/07/2005 18:45,Waterford,PA,USA,Unknown,"Floating Craft zooms away as I stop to look at it, weird!",01/07/2005,01/11/2005,
3938,Open,12/28/2004 21:00,Phoenixville,PA,USA,Triangle,Light along the sides with a shape of a triangle,12/29/2004,01/11/2005,
3939,Open,12/28/2004 21:00,Fox Chapel,PA,USA,Triangle,Thsi not one of the UFOs I see before.,01/01/2005,01/11/2005,
3940,Open,12/26/2004 23:10,Tobyhanna,PA,USA,Light,Red light in the Sky,12/26/2004,01/11/2005,
3941,Open,12/25/2004 01:00,Bellefonte,PA,USA,Formation,Three bright lights flying in a v formation that were following a smaller yellow-white light.,02/24/2005,05/24/2005,
3942,Open,12/24/2004 00:00,Philadelphia,PA,USA,Disk,"clear view of a flying saucer,hovering, and beaming down a light.",04/20/2006,05/15/2006,
3943,Open,12/22/2004 01:00,Lansdale (on highway),PA,USA,Unknown,"Craft was speeding along at an insane speed and then stopped on the dot, hovered then flew back at an insane speed.",12/28/2004,01/11/2005,
3944,Open,12/16/2004 04:30,Ardmore,PA,USA,Unknown,"Bright, randomly flashing, zig-zagging craft or object (possibly orb) off in the distance.",12/16/2004,01/11/2005,
3945,Open,12/13/2004 21:07,Upper Black Eddy,PA,USA,Circle,fast ball of light moving every which way,12/14/2004,12/14/2004,
3946,Open,12/05/2004 07:00,East Stroudsburg,PA,USA,Light,"object in the vacinity of the airplane that appeared to be a bright orange light, similar to what you would see as the sun rise reflect",12/05/2004,12/14/2004,
3947,Open,12/04/2004 00:45,Pittsburgh,PA,USA,Orb,"Glowing orange orb moving at high speed and changing direction over city of Pittsburgh, PA",12/03/2004,12/14/2004,
3948,Open,12/03/2004 02:37,York,PA,USA,Other,"Strange glows appeared in sky, moving about in realativly close range.",12/13/2004,12/14/2004,
3949,Open,11/28/2004 01:00,Mckeesport,PA,USA,Disk,"i was outside my house ,,when i saw a bright light in the sky. i called my wife out to see we watched for 20 min. it changed  direction",11/28/2004,12/03/2004,
3950,Open,11/27/2004 16:45,Clarion,PA,USA,Circle,"I was heading in my daughter's garage on the east side of the house and noticed what I fist thought was a hot air balloon, which therea",12/09/2004,12/14/2004,
3951,Open,11/13/2004 23:20,Montgomeryville,PA,USA,Chevron,One chevron-like object appeared in Casseopia was then joined by 3-4 others that circled briefly then flew west.,11/13/2004,12/03/2004,
3952,Open,11/13/2004 21:07,Doylestown,PA,USA,Light,threr were two distinct ships i even saw one turn and a flash off the metal shined from the other ship,11/13/2004,12/03/2004,
3953,Open,11/13/2004 05:20,Duncansville/Altoona,PA,USA,Light,Redish Pink light moved at signifigant speed,11/13/2004,12/03/2004,
3954,Open,11/09/2004 20:00,Fairfield,PA,USA,Disk,3 craft with saucer like appearance within miles of underground pentagon.,11/10/2004,12/03/2004,
3955,Open,11/08/2004 22:30,McKees Rocks,PA,USA,Unknown,"Red, green and blue horizontal lights, up to five crafts - not in formation",11/16/2004,12/03/2004,
3956,Open,11/08/2004 22:00,Spring City,PA,USA,Changing,"Pulsating, multicolor and moves close and back.",11/08/2004,11/09/2004,
3957,Open,11/07/2004 20:00,Barnesville,PA,USA,Flash,Giant LED light,11/14/2004,12/03/2004,
3958,Open,11/06/2004 23:45,Reading,PA,USA,Light,"While driving home from work there was a BRIGHT light blinking red,blue, and white stationary high above the ""mountain"". After being ho",11/06/2004,11/09/2004,
3959,Open,11/06/2004 18:00,Bradford,PA,USA,Fireball,Green Fireball,11/18/2004,12/03/2004,
3960,Open,11/05/2004 05:15,Philadelphia,PA,USA,Fireball,2 bright lights spherical fireball type shape close together high up in the sky.  ((NUFORC Note:  Venus and Jupiter.  PD)),11/05/2004,11/09/2004,
3961,Open,11/03/2004 22:35,Sunbury,PA,USA,Oval,Fastwalker over lunar disk Nov.3rd 2004,11/08/2004,11/09/2004,
3962,Open,11/03/2004 19:20,Girard Township,PA,USA,Rectangle,"Glowing objects,flying in formation,around Lake Erie",11/15/2004,12/03/2004,
3963,Open,10/24/2004 23:30,Pittsburgh/New Castle,PA,USA,Fireball,Traveling East bound on I-76 (Penn. Turnpike) at mile marker 12/13. I witnessed an extremely bright blue.  ((Meteor??)),10/29/2004,11/02/2004,
3964,Open,10/24/2004 23:10,Leet,PA,USA,Fireball,Blue-Green fireball trailing smoke or condensation Oct 24th around 23:00  ((NUFORC Note:  Possible meteor.  PD)),10/28/2004,11/02/2004,
3965,Open,10/24/2004 22:00,Pittsburgh/New Castle,PA,USA,,Green light fills up sky ((NUFORC Note:  Possible meteor.  PD)),10/26/2004,10/27/2004,
3966,Open,10/24/2004 21:21,Trainer,PA,USA,Unknown,Fast circular movement behind clouds for about 10-15 minutes in total ((NUFORC Note:  Possible meteor.  PD)),10/24/2004,10/27/2004,
3967,Open,10/24/2004 19:30,Bethlehem,PA,USA,Other,Blue orbs appeared near lunar eclipse,02/02/2005,02/08/2005,
3968,Open,10/13/2004 17:14,Titusville,PA,USA,Oval,"It was silver, it had no windows, it made no noise and glided accross the sky  above me before....",01/19/2005,01/19/2005,
3969,Open,10/06/2004 22:15,Marietta,PA,USA,Triangle,Slow and low flying triangular craft with lights some blinking with a slight engine sound,10/06/2004,10/27/2004,
3970,Open,10/05/2004 20:30,Coatesville,PA,USA,Other,White light with two rows of red lights following behind.,10/11/2004,10/27/2004,
3971,Open,10/03/2004 19:00,Perkasie,PA,USA,Cigar,Clear night sky 2 pale orange cigar shape went from south to north at high speed .,10/03/2004,10/27/2004,
3972,Open,09/26/2004 22:15,Philadelphia,PA,USA,Formation,"sighting in philly south of the city moving west of 3 lights that seemed to be independant, and flying in formation",09/26/2004,09/29/2004,
3973,Open,09/24/2004 20:19,Strattanville,PA,USA,Disk,orange glowing ufo,09/24/2004,09/29/2004,
3974,Open,09/21/2004 22:00,State College,PA,USA,Light,We saw a bright light that reached intense speeds and had abrupt stops.,03/17/2005,05/24/2005,
3975,Open,09/20/2004 19:00,Coatesville,PA,USA,Cross,Unkown Craft Flying Over Coatesville.,09/20/2004,09/29/2004,
3976,Open,09/18/2004 22:30,State College,PA,USA,Light,Light that zigzaged across the sky and dissapeared,09/18/2004,09/29/2004,
3977,Open,09/15/2004 19:00,Litchfield,PA,USA,Rectangle,After picking my children up from their grandparent's home in my brand new 2004 F-150 that had digital radio and cd that were off on ou,01/21/2017,01/26/2017,
3978,Open,09/13/2004 20:25,Harleysville,PA,USA,Unknown,"Sep 13, 8:25 PM- witnessed ship that had a Mercedes like logo above Harleysville, PA",09/16/2004,09/29/2004,
3979,Open,09/10/2004 22:00,Mount Cobb,PA,USA,Unknown,Rounded Triangle,11/01/2004,11/02/2004,
3980,Open,09/06/2004 16:45,Zelienople,PA,USA,Other,"On Interstate 79, we spotted a Y shaped white/silver craft above the treeline.  It was making unbelievable circular maneurvers",09/07/2004,09/09/2004,
3981,Open,09/05/2004 23:10,Titusville,PA,USA,Light,Bright object traveling NE to SW,10/07/2004,10/27/2004,
3982,Open,09/03/2004 21:20,Hegins,PA,USA,Fireball,Fireball,09/09/2004,09/09/2004,
3983,Open,09/03/2004 20:20,Hegins,PA,USA,Fireball,Fireball,09/07/2004,09/09/2004,
3984,Open,09/01/2004 20:00,Linglestown,PA,USA,Triangle,Bright light becomes three trinagle craft over I81 Linglestown area,01/14/2006,02/14/2006,
3985,Open,08/31/2004 21:30,Wellsboro,PA,USA,Other,While camping at a campground nestled between hills in North Central Pennsylvania my husband and I observed what looked like a small cl,09/07/2004,09/09/2004,
