,Link,Occurred,City,State,Country,Shape,Summary,Reported,Posted,Media
2629,Open,08/26/2012 20:45,Grove City,PA,USA,Light,Same object as reported on 8/6/12 grove city pa.,08/26/2012,09/24/2012,
2630,Open,08/25/2012 21:00,Allentown,PA,USA,Circle,Cluster of lite blue lights,08/26/2012,09/24/2012,
2631,Open,08/25/2012 21:00,East Earl,PA,USA,Unknown,"My husband and I saw 15 to 20 pulsating red/yellow lights in formation that broke up coming from east to west, flying directly over us",08/30/2012,09/24/2012,
2632,Open,08/25/2012 21:00,West Homestead,PA,USA,Orb,Bright orange orb with a blue aura around it,08/25/2012,09/24/2012,
2633,Open,08/23/2012 21:45,Williamsport,PA,USA,Fireball,Orangish yellow orb seen by a friend and I.,08/27/2012,09/24/2012,
2634,Open,08/19/2012 23:00,Lake Ariel,PA,USA,Formation,Formation of very large silent red-orange elliptical lights over Lake Ariel PA 8/19/12,08/20/2012,09/24/2012,
2635,Open,08/18/2012 22:45,Erie,PA,USA,Fireball,"Fireball over Erie Pa. 8/18/12 duration, no more than 4 minutes.",08/18/2012,08/19/2012,
2636,Open,08/18/2012 21:15,Erie,PA,USA,Formation,Beautiful 13  bright orange light formation in Erie PA 8/18/12  9:15 PM  lasted 4-7 minutes,08/23/2012,09/24/2012,
2637,Open,08/18/2012 21:15,Erie,PA,USA,,13 bright orange lights on 8/18/12 Erie PA   9:15 pm to approximately 9:22 pm,08/31/2012,09/24/2012,
2638,Open,08/18/2012 00:00,,PA,USA,Oval,2 pictures taken back to back.,10/15/2012,10/30/2012,
2639,Open,08/17/2012 21:00,Conway,PA,USA,Circle,Orange fire balls made no sound,08/17/2012,08/19/2012,
2640,Open,08/17/2012 20:30,Pittsburgh,PA,USA,Light,Mysterious lights over city of Pittsburgh.,08/17/2012,08/19/2012,
2641,Open,08/17/2012 20:00,Schwencksville,PA,USA,Other,2 orange/red orbs hovering and moving erratically south west to east of zip 19473,08/20/2012,09/24/2012,
2642,Open,08/16/2012 21:05,Nazareth,PA,USA,Unknown,"I saw a very bright light one night as I was taking out the recycling, when I returned with another can, it was gone.",08/16/2012,08/19/2012,
2643,Open,08/14/2012 21:00,York,PA,USA,Fireball,"I saw a round orange object flickering like fire, It stopped, then made a right turn and headed away and faded into a cloud.",08/25/2012,09/24/2012,
2644,Open,08/12/2012 00:40,Bird in Hand,PA,USA,Oval,Was looking north when I saw what appeared to be 15 orange lights moving at aircraft speed below the cloud cover. I noticed more appear,08/11/2012,08/19/2012,
2645,Open,08/12/2012 00:15,Brodheadsville,PA,USA,Flash,Flashbulb tight occurence on 3 consecutive nights ocurring same time  all 3 nights and same location of night sky.,10/06/2012,10/30/2012,
2646,Open,08/11/2012 21:45,Lake Ariel,PA,USA,Unknown,Bright light in sky that seem to come down into atmosphere.,08/11/2012,08/19/2012,
2647,Open,08/09/2012 22:00,Yardley,PA,USA,Oval,"Three pulsating objects in the sky, moving independently and joined by two more before disappearing",08/10/2012,08/19/2012,
2648,Open,08/08/2012 21:30,Philipsburg,PA,USA,Fireball,"Five reddish,orange balls slowly moving south over town.One ball staying still while the other four creating semetrical patterns in the",08/19/2012,08/19/2012,
2649,Open,08/07/2012 23:00,Warriors Run,PA,USA,Light,Orange Ball Over Northeast PA,08/07/2012,08/19/2012,
2650,Open,08/07/2012 23:00,Warriors Run,PA,USA,Light,Orange ball over Luzerne County,08/07/2012,08/19/2012,
2651,Open,08/07/2012 20:00,Pottsville,PA,USA,Unknown,Orange light moving slowly across the sky.,08/08/2012,08/19/2012,
2652,Open,08/06/2012 22:30,Conway and Economy Boro,PA,USA,Fireball,"On Saturday, August 6th, 2012 we attended Conway Community Days.  After the fireworks everyone started clearing out and we let our 8 ye",08/21/2012,09/24/2012,
2653,Open,08/06/2012 22:00,Exeter,PA,USA,Other,A fleet of UFO's  in Exeter PA,08/08/2012,08/19/2012,
2654,Open,08/06/2012 21:59,Van Voorhis,PA,USA,Light,Lights flies through sky followed by helicopter group.,08/07/2012,08/19/2012,
2655,Open,08/06/2012 19:50,Grove City,PA,USA,Light,Bright white light in small town pa.,08/06/2012,08/19/2012,
2656,Open,08/06/2012 18:00,Philadelphia,PA,USA,Rectangle,"Black rectangled shaped object, polsating like a jelly fish, appeared and observed me.",08/28/2012,09/24/2012,
2657,Open,08/06/2012 10:16,Erie,PA,USA,Light,Bright White Light in the Sky.,08/06/2012,08/19/2012,
2658,Open,08/06/2012 00:00,Lewistown,PA,USA,Light,"Changing color light moving very fast.  ((NUFORC Note:  Possible ""twinkling"" star, we suspect.  PD))",08/09/2012,08/19/2012,
2659,Open,08/04/2012 21:20,Washington,PA,USA,Light,Red balls of light,08/05/2012,08/05/2012,
2660,Open,08/04/2012 21:05,Warrington,PA,USA,Fireball,3 red fireballs/orbs witnessed in Warrington Bucks County PA,08/05/2012,08/19/2012,
2661,Open,08/02/2012 21:00,Dubois,PA,USA,,The report dated 8-2-12 in Dubois PA is a hoax.  I read the same report last year. Check your files.,10/18/2012,10/30/2012,
2662,Open,08/01/2012 22:45,Erie,PA,USA,Light,Erie moving lights in the sky over Lake Erie,08/26/2012,09/24/2012,
2663,Open,07/30/2012 20:00,Clifton Heights,PA,USA,Circle,White lights moving in a fast steady pace,07/30/2012,08/05/2012,
2664,Open,07/29/2012 22:21,Sinking Spring,PA,USA,Circle,3 reddish orange slow moving lights in the sky,07/29/2012,08/05/2012,
2665,Open,07/29/2012 21:30,Gap,PA,USA,Fireball,6 fireballs traveling in Pennsylvania.,07/29/2012,08/05/2012,
2666,Open,07/28/2012 21:15,Cranberry Township,PA,USA,Fireball,"Three fireballs in triangular formation that changed color from red, orange, and white",07/30/2012,08/05/2012,
2667,Open,07/28/2012 20:55,Liberty Boro,PA,USA,Triangle,Object that looked like a balloon on fire traveling across sky,07/30/2012,08/05/2012,
2668,Open,07/25/2012 03:56,Fairless Hills,PA,USA,Circle,Bright Light,07/25/2012,08/05/2012,
2669,Open,07/25/2012 03:00,Audubon,PA,USA,Teardrop,Very bright  lights over East of Philadelphia PA.,07/25/2012,08/05/2012,
2670,Open,07/24/2012 22:30,Adamsville,PA,USA,Sphere,"One round orange sphere 5-6' around w/ bright circular glowing bottom center cruisin thru 20 mph, 100 ' tops of trees",07/25/2012,08/05/2012,
2671,Open,07/22/2012 15:56,Lakewood,PA,USA,Oval,"A strange object in the sky, portrayed a beam of light, as I took the picturee of it, it suddenly vanished.",07/21/2012,08/05/2012,
2672,Open,07/21/2012 21:50,Sewickley,PA,USA,Fireball,Orange fireball traveling across sky,07/21/2012,08/05/2012,
2673,Open,07/21/2012 21:30,Orefield,PA,USA,Orb,"Orange orbs over night sky in Lehigh Valley, PA",07/22/2012,08/05/2012,
2674,Open,07/21/2012 20:15,Reading,PA,USA,Oval,"My wife and I saw one fiery red/orange orb that was ascending vertically as it traveled SSE over Reading, PA around 9:50 PM on 7/21/12.",07/22/2012,08/05/2012,
2675,Open,07/17/2012 21:50,Johnstown,PA,USA,Triangle,"3 Glowing orbs in triangle formation johnstown, PA",07/18/2012,08/05/2012,
2676,Open,07/15/2012 20:00,Gettysburg,PA,USA,Triangle,"Delta wing, no lights, walnut shaped pod on underside with rectangular row of ports with grenishgrayish glow",04/19/2013,05/15/2013,
2677,Open,07/14/2012 21:30,Fisher,PA,USA,Fireball,"7 fiery pulsating lobes seen rising from woods near Fisher, PA on July 14, 2012",07/14/2012,08/05/2012,
2678,Open,07/13/2012 22:32,Industry,PA,USA,Fireball,"We viewed a firey orange globe come into sight, stagger, then disasseapear at the pace of an airliner.",07/13/2012,08/05/2012,
2679,Open,07/13/2012 21:50,Erie,PA,USA,Light,We saw 3 orange lights about 50-100 feet apart moving in tandem up in the sky.,07/14/2012,08/05/2012,
2680,Open,07/13/2012 21:15,North Versailles,PA,USA,Light,"Several dozen orange lights in the sky over North Versailles Pa on July 13, 2012, around 21:15 hours",07/15/2012,08/05/2012,
2681,Open,07/11/2012 23:30,Mechanicsburg,PA,USA,Circle,Strange ball of light flashed in and disappears.,07/11/2012,08/05/2012,
2682,Open,07/11/2012 23:30,Stonington,PA,USA,Flash,2 Bright lightly strobing objects in the area of the Constellation Scorpius.,07/12/2012,08/05/2012,
2683,Open,07/09/2012 23:00,Reading,PA,USA,Light,Light  moving in the sky.  ((anonymous report)),07/09/2018,07/13/2018,
2684,Open,07/09/2012 21:50,West Middlesex,PA,USA,Circle,Saw very fast moving object  high in the sky heading from South to North which was round and yellowish red in color.,07/10/2012,08/05/2012,
2685,Open,07/09/2012 21:00,Doylestown,PA,USA,Rectangle,DARK RECTANGLE WITH ABOUT 16 LIGHTS UNDER IT (2 rows of 8) MOVING SLOW AND LOW!,07/09/2012,08/05/2012,
2686,Open,07/07/2012 22:50,Johnstown,PA,USA,Circle,"Fireball like object across Cambria county in Pennsylvania, US.",07/07/2012,08/05/2012,
2687,Open,07/07/2012 22:00,Oaks,PA,USA,Orb,Three orange orbs traveling across night sky,07/07/2012,08/05/2012,
2688,Open,07/07/2012 22:00,Altoona,PA,USA,Circle,Orange colored light moving in multiple directions and hovering unlike any helicopter or airplane then disappearing suddenly.  Over PA,07/07/2012,08/05/2012,
2689,Open,07/07/2012 21:30,Jersey Shore,PA,USA,Fireball,"Multiple glowing orbs from horizon to cloud height, sometimes in triangle formation.",07/07/2012,08/05/2012,
2690,Open,07/07/2012 21:00,Sharon,PA,USA,Fireball,"Moving fireball that climbed up, then disappeared.",07/13/2012,08/05/2012,
2691,Open,07/06/2012 22:40,Allentown,PA,USA,Unknown,Orange/ yellowish orb floating through sky,07/06/2012,08/05/2012,
2692,Open,07/06/2012 22:00,Pittsburgh,PA,USA,Fireball,"Orange ""fireball"" over bloomfield during Gallery Crawl",07/07/2012,08/05/2012,
2693,Open,07/06/2012 21:45,Millersburg,PA,USA,Light,"A bright white ball like object was spotted flying near a mountain, then disappearing.",07/06/2012,08/05/2012,
2694,Open,07/05/2012 21:42,New Freedom,PA,USA,Light,"UFO sighting over a carnival in Southern York County, Pennsylvania, caught on camera.",07/06/2012,08/05/2012,
2695,Open,07/04/2012 23:10,Reading,PA,USA,Fireball,"3 Large Fireballs rose from ground in succession and followed each other West to East across sky into Heat Lightening near Reading, PA",07/04/2012,08/05/2012,
2696,Open,07/04/2012 22:20,Beaver Falls,PA,USA,Fireball,"""Fireball""-type crafts over Beaver Falls, PA",07/04/2012,08/05/2012,
2697,Open,07/04/2012 22:00,Ridley Park,PA,USA,Sphere,2 amber colored lights flying in the same flight path and then darting off and vanishing.,07/25/2014,07/26/2014,
2698,Open,07/04/2012 22:00,Hyde,PA,USA,Light,"Several witnesses to strange ""Patriotic"" lights over 4th of July Holiday, many photographs.",07/07/2012,08/05/2012,
2699,Open,07/04/2012 21:50,Pottstown,PA,USA,Sphere,Fire colored sphere in Pottstown.,07/06/2012,08/05/2012,
2700,Open,07/04/2012 21:45,Pottstown,PA,USA,Fireball,Red/orange fireball moving slowly,07/07/2012,08/05/2012,
2701,Open,07/04/2012 21:30,New Castle,PA,USA,Disk,Orange disk-shaped objects that fly under the clouds without sound.,07/04/2012,08/05/2012,
2702,Open,07/04/2012 21:30,Erie,PA,USA,Fireball,Giant orange/red globe slowly moving across the sky.,07/04/2012,08/05/2012,
2703,Open,07/04/2012 21:30,West Mifflin/Pittsburgh,PA,USA,Fireball,"6 orange lights were seen in Pittsburgh, PA.",07/06/2012,08/05/2012,
2704,Open,07/04/2012 21:30,Auburn,PA,USA,Fireball,Firey Orb in night sky,07/14/2012,08/05/2012,
2705,Open,07/04/2012 21:15,Bristol,PA,USA,Fireball,It looked like a yellow/redish fireball and it looked like something was hanging down from it on fire. It went down the street behind u,07/04/2012,08/05/2012,
2706,Open,07/04/2012 05:00,Philadelphia,PA,USA,Other,2 objects moving together across the sky during the day.,07/25/2012,08/05/2012,
2707,Open,07/03/2012 23:00,Shillington,PA,USA,Fireball,"Orange fiery orb travels in slow erratic path from east to northeast over Shillington and Reading, PA",07/03/2012,07/04/2012,
2708,Open,07/02/2012 23:00,State College,PA,USA,Other,Lights in the shape of an oval.,07/02/2012,07/04/2012,
2709,Open,07/01/2012 22:20,Sunbury,PA,USA,Oval,Orange Globe Hovering over Sunbury.,07/02/2012,07/04/2012,
2710,Open,07/01/2012 22:00,Dingmans Ferry,PA,USA,Oval,Saw orange/amber burning kind of orb flying low and silently North to South and then completely vanish as jet approached from the South,07/03/2012,07/04/2012,
2711,Open,07/01/2012 11:00,Ephrata,PA,USA,Cone,Gold Metallic cone shape object in the sky above Ephrata,10/30/2012,10/30/2012,
2712,Open,07/01/2012 01:00,Pittsburgh,PA,USA,Light,"Watched 2 craft in the night sky, one that went extremely fast, one that went extremely slow.",07/09/2012,08/05/2012,
2713,Open,06/30/2012 22:15,Erie,PA,USA,Sphere,"Witnessed two incredible UFOs heading east Erie, PA 6/30/12.",06/30/2012,07/04/2012,
2714,Open,06/30/2012 21:30,Jamestown,PA,USA,Disk,Orange Orb/Disc over Pymatuming Lake,07/01/2012,07/04/2012,
2715,Open,06/30/2012 08:30,Philadelphia,PA,USA,Light,((HOAX??))  unidentified object mm n ts,06/30/2012,07/04/2012,
2716,Open,06/30/2012 02:30,Allentown,PA,USA,Fireball,"Red flying object,  for about 4 minutes in our neighboorhod.  It did not made any noise and it was able to  fly horisontally and vertic",06/30/2012,07/04/2012,
2717,Open,06/28/2012 00:00,Harrisburg,PA,USA,,"Neon green light filled the air just south of Harrisburg, PA",07/02/2012,07/04/2012,
2718,Open,06/27/2012 22:45,Hamburg,PA,USA,Unknown,"3 steady white lights with flashing red and green lights over Berks County, Pa.",06/28/2012,07/04/2012,
2719,Open,06/25/2012 23:30,Wilkes-Barre,PA,USA,Light,Circles of light rotating in two circular patterns,06/26/2012,07/04/2012,
2720,Open,06/25/2012 20:35,Ephrata,PA,USA,Fireball,Ball of light hovers above hillside slowly climbs to cloud height hovers again then disappears.,06/26/2012,07/04/2012,
2721,Open,06/24/2012 22:50,Wilkes-Barre,PA,USA,Fireball,"Two sphere like lights, flickering like a flame off in the distance, flew across the sky. They started a sizeable distance apart from o",06/24/2012,07/04/2012,
2722,Open,06/24/2012 00:00,Nanticoke,PA,USA,Orb,10+ red-orange orbs in sky,06/26/2012,07/04/2012,
2723,Open,06/23/2012 20:00,Allison Park,PA,USA,Unknown,"""Solar"" glowing ""object"" during sunset.",06/24/2012,07/04/2012,
2724,Open,06/23/2012 17:48,West Natcoke,PA,USA,Sphere,"Round, shiny object moving in a strange way with at least thirty objects.",07/08/2012,08/05/2012,
2725,Open,06/22/2012 23:00,Bethel Park,PA,USA,Fireball,It was a red pulsing orb and silently flew by my house from west to east.,06/27/2013,07/03/2013,
2726,Open,06/21/2012 03:45,Clearfield,PA,USA,Other,Star-Like object moving NW to SE,06/21/2012,07/04/2012,
2727,Open,06/16/2012 20:00,Butler,PA,USA,Other,"I don’t know if it was a UFO or whatever, but when I was in about fourth grade I saw what I thought was a man fall from the sky.",02/16/2019,02/22/2019,
2728,Open,06/15/2012 23:00,Harleysville,PA,USA,Fireball,It was so wierd.  It looked like it was floating over.  The town  going from red and white back and forth over 10 mins.,07/01/2012,07/04/2012,
2729,Open,06/15/2012 19:20,Pittsburgh (general area),PA,USA,Oval,Yellowish orange orb,06/15/2012,06/20/2012,
2730,Open,06/10/2012 22:15,Pittsburgh,PA,USA,Fireball,3 orange pulsating fireballs appeared abruptly and faded as if cloaking device used,06/10/2012,06/14/2012,
2731,Open,06/10/2012 19:45,Landingville,PA,USA,Oval,Three people that seen a very brite glowing aircraft shoot across the sky.,06/10/2012,06/14/2012,
2732,Open,06/09/2012 21:45,Philipsburg,PA,USA,Circle,Witnessed three glowing orange objects traveling northewest in a triangular formation with a forth following behind,06/09/2012,06/14/2012,
2733,Open,06/09/2012 09:45,Havertown,PA,USA,Orb,"Yellow orb, changes to white flashing light, moving across the night sky",07/10/2012,08/05/2012,
2734,Open,06/08/2012 22:30,North Wales,PA,USA,Circle,There was a circle shaped object moving very fast with blue lights flashed very fast.,06/09/2012,06/14/2012,
2735,Open,06/07/2012 23:35,State College,PA,USA,Orb,"Standing on our back deck, looking toward the south, I noticed an orange orb floating about 15 degrees above the treeline. It was stati",06/07/2012,06/08/2012,
2736,Open,06/07/2012 23:35,State College,PA,USA,Orb,Orange orb sighted near State College.,06/11/2012,06/14/2012,
2737,Open,06/07/2012 21:57,Masontown,PA,USA,Light,Very slow & bright light. No aircraft ident. or post. light. Sighting lasted for about 2.5 minutes. Weird movements. Went NE.,06/07/2012,06/08/2012,
2738,Open,06/05/2012 22:45,McKees Rocks (Kennedy Twp.),PA,USA,Circle,Two red/orange circular objects moving from NE to SW over McKees Rocks & Kennedy Twp. Just W of Pittsburgh.,05/31/2013,06/02/2013,
2739,Open,06/05/2012 22:30,Mckees Rocks,PA,USA,Circle,Saw 2 bright orange lights followed by two more,06/05/2012,06/08/2012,
2740,Open,06/02/2012 23:00,Aliquippa,PA,USA,Light,Flashing lights moving at incredible speeds over Alliquippa,06/03/2012,06/05/2012,
2741,Open,06/02/2012 22:15,Cranberry Township,PA,USA,Sphere,"10 fireball fly over PIttsburgh area in straight line, 2 people took videos",06/04/2012,06/05/2012,
2742,Open,06/02/2012 21:25,Phoenixville,PA,USA,Light,"Orange-red lights in the sky in Phoenixville, PA",06/03/2012,06/05/2012,
2743,Open,05/31/2012 22:30,Greensburg,PA,USA,Light,Star-like light suddenly vanishes after a few minutes,06/12/2012,06/14/2012,
2744,Open,05/30/2012 21:00,McKean,PA,USA,Fireball,"Balls of fire seen in evening sky, over Erie, PA, area.",05/31/2012,06/05/2012,
2745,Open,05/28/2012 22:00,Royersford,PA,USA,Fireball,Orange fireball floats by royersford - limerick PA,05/28/2012,05/29/2012,
2746,Open,05/28/2012 18:00,Waynesburg,PA,USA,Light,Two unidentified flying objects traveling at incredible speeds changing course,05/28/2012,05/29/2012,
2747,Open,05/20/2012 22:00,Greensburg,PA,USA,Light,White light appeared in the middle of night sky.,05/22/2012,05/29/2012,
2748,Open,05/19/2012 22:30,Johnstown,PA,USA,Orb,Orange glowing orb or sphere hovering above the tree line.,05/20/2012,05/29/2012,
2749,Open,05/19/2012 21:00,Exton,PA,USA,Light,"Completely silent, bright, and randomly pulsating red ball or light flying rather slow over head then disappearing",05/20/2012,05/29/2012,
2750,Open,05/17/2012 21:20,Plum,PA,USA,Cone,strange orange light in sky,05/17/2012,05/29/2012,
2751,Open,05/15/2012 20:45,Downingtown,PA,USA,Oval,Reddish/orange objects flying in sync one behind the other.,05/16/2012,05/29/2012,
2752,Open,05/12/2012 21:30,Lebanon,PA,USA,Formation,"Three reddish orange lights flying in formation over Lebanon, PA",05/14/2012,05/29/2012,
2753,Open,05/12/2012 07:20,Millerton,PA,USA,,MADAR Node 104,05/29/2020,06/25/2020,
2754,Open,05/11/2012 22:00,Ambridge,PA,USA,Light,Four Bright yellow lights in night sky  following each other then vanished upwards and disappeared.,05/14/2012,05/29/2012,
2755,Open,05/11/2012 16:00,Mechanicsburg,PA,USA,Sphere,4 objects bright silver in apperance passed overhead in late afternoon,05/13/2012,05/29/2012,
2756,Open,05/08/2012 05:00,Hanover,PA,USA,Orb,"Orange glowing orb, bright white light emitting from it, levitating 100 ft off ground and moved out of sight",05/09/2012,05/13/2012,
2757,Open,05/05/2012 21:00,Natrona Heights,PA,USA,Sphere,"Witnessed 5 orange/yellow glowing fireballs in Natrona Heights, PA",05/05/2012,05/13/2012,
2758,Open,05/03/2012 00:30,Bristol,PA,USA,Cylinder,"""Venus"" disappeared, but was UFO.",07/24/2012,08/05/2012,
2759,Open,04/27/2012 23:27,Royersford,PA,USA,Oval,"Multi Colored UFO, Above the Limerick Power Plants (silent)",04/28/2012,05/13/2012,
2760,Open,04/27/2012 20:45,Olyphant,PA,USA,Fireball,"Sighting of (3) flaming balls in the sky, which we initially thought was an airplane on fire that eventually disappeared.",04/27/2012,05/13/2012,
2761,Open,04/26/2012 11:10,Monroeville,PA,USA,Circle,Light moving slowly.,04/26/2012,05/13/2012,
2762,Open,04/23/2012 22:21,Grindstone,PA,USA,Light,Large white object with a slight yellow tint seen being followed/chased by jets.,04/23/2012,05/13/2012,
2763,Open,04/22/2012 21:30,Carlisle,PA,USA,Sphere,Fast moving blue ball of light,04/24/2012,05/13/2012,
2764,Open,04/20/2012 09:34,Monroeville,PA,USA,Light,"Points of light, slowly moving, fade out.",04/19/2012,05/13/2012,
2765,Open,04/19/2012 17:45,Perkasie,PA,USA,Changing,Bright  white cresant shape light,04/22/2012,05/13/2012,
2766,Open,04/16/2012 22:30,Langhorne,PA,USA,Formation,3-4 lighted circles in the sky.,04/17/2012,04/18/2012,
2767,Open,04/12/2012 21:00,Dayton,PA,USA,Circle,A bright white light disappearing  and reappearing in the sky which then descended straight down out of sight.,04/13/2012,04/18/2012,
2768,Open,04/10/2012 02:15,Chalfont,PA,USA,Sphere,"Blue-green ball of light seen over Chalfont, Pa",04/12/2012,04/18/2012,
2769,Open,04/06/2012 21:50,Reading,PA,USA,Egg,"Left Lebanon Pa.towards Reading Pa.around 9:35PM about 10-15 minutes into our trip before Myerstown i noticed an extremely Bright,Silve",04/12/2012,04/18/2012,
2770,Open,04/06/2012 21:27,Pittsburgh,PA,USA,Light,UNBELIEVEABLE SPEED,04/08/2012,04/18/2012,
2771,Open,04/05/2012 17:45,Allentown,PA,USA,Rectangle,Rectangular UFO Lehigh Valley,04/06/2012,04/18/2012,
2772,Open,04/04/2012 00:15,Pgh,PA,USA,Circle,"My son who was 12 at the time, came from my parents house who lives behind me,came into the house screaming to me that he just saw a uf",10/02/2012,10/30/2012,
2773,Open,03/29/2012 20:30,McDonald,PA,USA,Diamond,"Lighted, diamond-shaped craft",03/29/2012,05/13/2012,
2774,Open,03/29/2012 05:22,York,PA,USA,Circle,3 lights moving right then left very slowly.,03/29/2012,05/13/2012,
2775,Open,03/27/2012 21:00,Reading,PA,USA,Light,"Two red blinking lights in Reading, PA.",03/28/2012,05/13/2012,
2776,Open,03/27/2012 05:10,Jessup,PA,USA,Changing,2 cloud like objects one half oval the other cigar shaped with pointed ends (almost like a mustache).  No sounds came from it.,03/27/2012,05/13/2012,
2777,Open,03/24/2012 19:45,Philadelphia,PA,USA,Circle,Parent & Child Circles on Sky.  ((NUFORC Note:  Possible advertising lights?  PD)),04/26/2012,05/13/2012,
2778,Open,03/23/2012 01:00,Milanville,PA,USA,Teardrop,"Small, bright white orb with tail flashed by 10' above Delaware River near Milanville, PA & Skinner's Falls, NY.",03/23/2012,05/13/2012,
2779,Open,03/22/2012 22:37,New Brighton,PA,USA,Unknown,"Bouncing object in sky in New Brighton, PA",03/22/2012,05/13/2012,
2780,Open,03/21/2012 21:32,Hanover Township,PA,USA,Light,"I wittnessed a very large, bright, white light which appeared in the night sky, remained for  30 seconds, then dimmed and exstinguished",03/21/2012,05/13/2012,
2781,Open,03/21/2012 19:30,Greensburg,PA,USA,Light,"I saw a light far up in the sky, it was moving east slowly and disappeared briefly. Then reappeared for only a second or two and then d",03/27/2012,05/13/2012,
2782,Open,03/20/2012 23:00,Boothwyn,PA,USA,,I was experimented on when I was very young and woke up with various lasting physical malformations.,11/24/2019,12/01/2019,
2783,Open,03/19/2012 08:30,Alburtis,PA,USA,Light,It was neat. Wonder what it was?,03/19/2012,05/13/2012,
2784,Open,03/18/2012 20:30,Butler,PA,USA,Flash,Something in the sky tonight,03/18/2012,05/13/2012,
2785,Open,03/18/2012 00:30,Johnstown,PA,USA,Circle,"Stationary light over ridge top, more appear then move away.",03/18/2012,05/13/2012,
2786,Open,03/16/2012 09:00,Erie,PA,USA,Fireball,"March 16, 2012 ufo fireball sighting!",05/24/2012,05/29/2012,
2787,Open,03/13/2012 21:30,Johnstown,PA,USA,Triangle,LARGE DELTA /TRIANGLE OBJECT,03/14/2012,03/16/2012,
2788,Open,03/09/2012 20:00,Beaver,PA,USA,Light,"Bright lights over Beaver, PA.  ((NUFORC Note:  Probable sightings of Venus and Jupiter.  PD))",03/11/2012,03/13/2012,
2789,Open,03/08/2012 21:00,Blue Bell,PA,USA,Triangle,"Triangular UFO moves slow and silent, changes direction sporadically",03/20/2012,05/13/2012,
2790,Open,03/05/2012 20:00,Hummelstown,PA,USA,Fireball,"Red fire ball with long blue tail light over Hummelstown, Pennsylvania",03/07/2012,03/13/2012,
2791,Open,03/03/2012 19:00,Philadelphia,PA,USA,Other,"About 7:00 p.m., my wife and I had just got back from the market WE WERE WALKING UP THE STEPS TO OUR PORCH . I JUST H",03/08/2012,03/13/2012,
2792,Open,03/03/2012 19:00,Philadelphia,PA,USA,Other,ABOUT 7:00PM OVER SKY OF PHILADELPHIA,03/08/2012,03/13/2012,
2793,Open,03/01/2012 21:00,Pittsburgh,PA,USA,Triangle,Triangled shape craft with bright red blue and white lights,03/02/2012,03/13/2012,
2794,Open,02/28/2012 23:57,Reading,PA,USA,Triangle,Triangular craft w/ bright white lights and sequencial red light moving from tip to tip; silent.((NUFORC Note:  Possible meteor.  PD)),02/28/2012,03/13/2012,
2795,Open,02/24/2012 20:00,Aliquippa,PA,USA,Triangle,Triangular massive object with red lights,02/27/2012,03/13/2012,
2796,Open,02/18/2012 19:30,Levittown,PA,USA,Oval,"Bright Red Light in the sky, got brighter glowing, then turned white and shot away through the sky.",02/18/2012,03/13/2012,
2797,Open,02/15/2012 20:49,South Huntingdon,PA,USA,Triangle,A very big and loud triangular shaped aircraft moving slow with three blue/white lights at each corner,02/15/2012,03/13/2012,
2798,Open,02/12/2012 08:00,Coatesville,PA,USA,Light,"Bright orange-red light hovers between trees moves west and disappears.

 500 Lights On Object0: Yes",02/12/2012,03/13/2012,
2799,Open,02/10/2012 17:00,Elizabeth Township,PA,USA,Triangle,Small battleship gray triangle in residential area,02/13/2012,03/13/2012,
2800,Open,02/06/2012 19:25,Trexlertown/Allentown,PA,USA,Light,Very bright light hovering in the sky.,02/06/2012,02/10/2012,
2801,Open,02/05/2012 20:10,South Williamsport,PA,USA,Light,"Strange yellow light moved up the side of the mountain, into the air and then disappeared.",02/05/2012,02/10/2012,
2802,Open,02/01/2012 14:00,Penfield (near),PA,USA,Cylinder,"Black cylinder, no windows, no motor, no wings,no writing",02/26/2012,03/13/2012,
2803,Open,01/28/2012 17:00,Conestoga,PA,USA,Teardrop,"Saw a teardrop craft moving fast, trail of bird followed.",02/09/2012,02/10/2012,
2804,Open,01/28/2012 17:00,Lansdale,PA,USA,Oval,Awesome spectaular,01/29/2012,02/03/2012,
